{
  "decision": "PASS",
  "summary": "The described documentation clarification matches the selected contract's Purpose and boundary and Lifecycle and adoption boundary: a generated proposal remains for human review, and only the authorized owner records adoption in the consumer's canonical architecture or other authoritative record. No new responsibility, dependency, or approval route is described.",
  "authorityIds": [
    "authoring-product-contract"
  ],
  "responsibility": [
    "Prepare human-reviewable decision proposals while keeping adoption with the authorized consumer owner."
  ],
  "reviewedScope": [
    "Described manual-dogfood guide wording clarification at the recorded revision."
  ],
  "prohibitedChanges": [
    "None identified in the described change."
  ],
  "findings": [],
  "ownerDecisionRequired": false
}
